{
  "id": "06-persistence-secret-plane",
  "title": "Persistence & Secret Plane",
  "subtitle": "Operational state lives in workflow.db; API keys and OAuth tokens cross a separate encrypted credential boundary",
  "category": "architecture",
  "diagramType": "data and trust boundary",
  "description": "A two-plane architecture view separating ordinary workflow, execution, context, and team persistence from the credential path in which AuthService caches narrowly, CredentialsDatabase encrypts fields, and credentials.db stores only Fernet tokens plus derivation metadata.",
  "sourceReview": "reviewed",
  "sourceRefs": [
    {"path": "server/core/container.py", "reason": "Dependency wiring for Database, CredentialsDatabase, EncryptionService, CacheService, and AuthService."},
    {"path": "server/main.py", "reason": "Startup ordering: initialize credentials.db, load/create salt, then initialize encryption with the server-scoped key."},
    {"path": "server/core/database.py", "reason": "Authoritative async SQLModel service for workflow.db persistence."},
    {"path": "server/models/database.py", "reason": "Operational tables for workflows, node parameters/outputs, executions, context support, teams, tasks, and settings."},
    {"path": "server/services/auth.py", "reason": "Single credential access surface and the distinct API-key and OAuth display caches; refresh tokens bypass the process cache."},
    {"path": "server/core/credentials_database.py", "reason": "Separate encrypted SQLite schema with metadata, EncryptedAPIKey, and EncryptedOAuthToken tables."},
    {"path": "server/core/encryption.py", "reason": "Fernet field encryption and PBKDF2-SHA256 key derivation at 600,000 iterations."},
    {"path": "server/services/plugin/credential.py", "reason": "Plugin Credential.resolve path that obtains API keys or OAuth tokens through AuthService."},
    {"path": "server/core/config.py", "reason": "DATA_DIR-rooted workflow/credential database paths and API_KEY_ENCRYPTION_KEY configuration."}
  ],
  "groups": [
    {"id": "state-plane", "label": "APPLICATION PERSISTENCE · workflow.db", "role": "data", "x": 50, "y": 125, "w": 750, "h": 830},
    {"id": "secret-plane", "label": "SECRET PLANE · credentials.db", "role": "security", "x": 840, "y": 125, "w": 1030, "h": 830}
  ],
  "nodes": [
    {"id": "runtime-services", "label": "Runtime services", "type": "application callers", "role": "system", "x": 100, "y": 190, "w": 290, "h": 150, "detail": ["Workflows · nodes · deployments", "Context · teams · settings"]},
    {"id": "database-service", "label": "Database", "type": "persistence service", "role": "data", "x": 470, "y": 190, "w": 280, "h": 150, "detail": ["Async SQLModel / SQLite", "One operational access surface"]},
    {"id": "workflow-db", "label": "workflow.db", "type": "SQLite data store", "role": "data", "x": 280, "y": 540, "w": 330, "h": 200, "detail": ["Workflows · node params · outputs", "Executions · context · teams", "No encrypted credential tables"]},
    {"id": "credential-callers", "label": "Plugin credentials", "type": "secret consumers", "role": "system", "x": 870, "y": 190, "w": 250, "h": 150, "detail": ["Credential.resolve", "Connection / provider clients"]},
    {"id": "auth-service", "label": "AuthService", "type": "secret facade", "role": "security", "x": 1170, "y": 190, "w": 250, "h": 150, "detail": ["Only service-level credential route", "Store · resolve · remove"]},
    {"id": "credential-caches", "label": "Process caches", "type": "bounded secret cache", "role": "runtime", "x": 1570, "y": 190, "w": 250, "h": 150, "detail": ["API keys + model metadata", "OAuth access/display fields only"]},
    {"id": "credentials-database", "label": "CredentialsDatabase", "type": "encrypted persistence", "role": "security", "x": 1170, "y": 490, "w": 320, "h": 180, "detail": ["EncryptedAPIKey", "EncryptedOAuthToken", "credentials_metadata"]},
    {"id": "encryption-password", "label": "API_KEY_ENCRYPTION_KEY", "labelLines": ["API_KEY_", "ENCRYPTION_KEY"], "type": "server configuration", "role": "security", "x": 870, "y": 510, "w": 250, "h": 150, "detail": ["Minimum 32 characters", "Loaded at startup"]},
    {"id": "encryption-service", "label": "EncryptionService", "type": "cryptographic boundary", "role": "security", "x": 870, "y": 750, "w": 250, "h": 150, "detail": ["PBKDF2-SHA256 · 600,000", "Fernet encrypt / decrypt"]},
    {"id": "credentials-db", "label": "credentials.db", "type": "encrypted SQLite", "role": "data", "x": 1560, "y": 710, "w": 270, "h": 190, "detail": ["Ciphertext fields only", "32-byte salt in metadata", "Separate from workflow.db"]}
  ],
  "relationships": [
    {"id": "r-runtime-database", "from": "runtime-services", "to": "database-service", "label": "persists operational state", "fromSide": "bottom", "toSide": "bottom", "waypoints": [[245, 400], [610, 400]], "labelAt": [425, 400]},
    {"id": "r-database-workflow", "from": "database-service", "to": "workflow-db", "label": "reads and writes SQLModel rows", "protocol": "sqlite+aiosqlite", "fromSide": "bottom", "toSide": "top", "waypoints": [[610, 450], [445, 450]], "labelAt": [525, 450]},
    {"id": "r-plugin-auth", "from": "credential-callers", "to": "auth-service", "label": "requests secret resolution", "fromSide": "bottom", "toSide": "bottom", "waypoints": [[995, 400], [1295, 400]], "labelAt": [1145, 400]},
    {"id": "r-auth-cache", "from": "auth-service", "to": "credential-caches", "label": "populates safe cache", "fromSide": "right", "toSide": "left", "labelAt": [1495, 265]},
    {"id": "r-auth-credentials", "from": "auth-service", "to": "credentials-database", "label": "save · retrieve · delete", "fromSide": "bottom", "toSide": "top", "labelAt": [1335, 415]},
    {"id": "r-key-encryption", "from": "encryption-password", "to": "encryption-service", "label": "derives in-memory Fernet key", "fromSide": "bottom", "toSide": "top", "labelAt": [995, 710]},
    {"id": "r-credentials-encryption", "from": "credentials-database", "to": "encryption-service", "label": "calls encrypt / decrypt per field", "fromSide": "bottom", "toSide": "right", "waypoints": [[1330, 700], [1190, 700], [1190, 825]], "labelAt": [1280, 700]},
    {"id": "r-credentials-store", "from": "credentials-database", "to": "credentials-db", "label": "stores ciphertext rows and salt", "protocol": "SQLite", "fromSide": "bottom", "toSide": "top", "waypoints": [[1330, 690], [1695, 690]], "labelAt": [1515, 690]}
  ],
  "callouts": [
    {"id": "state-boundary-note", "title": "Blast-radius boundary", "x": 100, "y": 800, "w": 650, "h": 110, "lines": ["A workflow.db dump carries operational state,", "but never the encrypted API-key or OAuth tables."]},
    {"id": "refresh-token-note", "title": "Refresh-token rule", "x": 1525, "y": 395, "w": 305, "h": 115, "lines": ["Refresh tokens are never cached.", "AuthService reads them from", "credentials.db for every use."]}
  ],
  "prompt": {
    "primaryRequest": "Create a two-plane data architecture diagram that makes the separation between workflow.db operational persistence and the encrypted credentials.db secret plane unmistakable, including the real service boundaries and startup-derived encryption key path.",
    "composition": "Use two large side-by-side framed planes. The left plane is a short Runtime Services → Database → workflow.db flow with a blast-radius note. The right plane flows Plugin Credentials → AuthService → CredentialsDatabase → encrypted credentials.db, with a side cache, a server key feeding EncryptionService, and a refresh-token warning near the cache.",
    "constraints": ["Keep workflow.db and credentials.db visually separate", "Show AuthService as the single service-level credential access surface", "Show the API_KEY_ENCRYPTION_KEY and persisted salt as inputs to the encrypted-store design", "State that OAuth refresh tokens bypass the process cache", "Do not imply plaintext secrets are persisted"],
    "avoid": ["showing the unused credential backend factory as the active runtime path", "placing API keys in workflow.db", "plaintext secret labels inside credentials.db", "bidirectional arrows"]
  }
}
