{
  "id": "07-workspace-anatomy",
  "title": "Workspace Anatomy",
  "subtitle": "Immutable workflow IDs resolve to mutable slug directories that isolate files, generated media, CLI worktrees, and materialized skills",
  "category": "architecture",
  "diagramType": "filesystem and consumer topology",
  "description": "A source-backed anatomy of per-workflow workspaces: the database-backed id-to-slug resolver selects a DATA_DIR-rooted directory, contained consumers read and write artifacts through traversal-safe helpers, and CLI agents receive the workspace for worktrees and per-workflow skill discovery.",
  "sourceReview": "reviewed",
  "sourceRefs": [
    {"path": "server/core/paths.py", "reason": "Canonical DATA_DIR, workspaces_dir, workspace_dir, and shipped example-workflow path rules."},
    {"path": "server/services/workspace_locator.py", "reason": "Single immutable workflow-id to mutable slug translation and safe default-workspace policy."},
    {"path": "server/services/workflow.py", "reason": "Workflow service creation and injection of the resolved workspace directory into execution context."},
    {"path": "server/services/workflow_storage/handlers.py", "reason": "Workflow rename path that moves a slug-keyed workspace directory."},
    {"path": "server/routers/workspace.py", "reason": "Workspace file-serving and bounded upload routes using immutable workflow IDs and contained relative paths."},
    {"path": "server/nodes/filesystem/_backend.py", "reason": "WorkspaceBackend and resolve_within path normalization, symlink/junction containment, and atomic write boundary."},
    {"path": "server/services/media/workspace.py", "reason": "Media references and reads/writes rooted in the executor-injected workspace."},
    {"path": "server/nodes/agent/claude_code_agent/_skills.py", "reason": "Per-workflow .claude/skills materialization with support-file preservation and diff updates."},
    {"path": "server/services/cli_agent/session.py", "reason": "Per-node CLI worktree placement and workspace --add-dir behavior."}
  ],
  "groups": [
    {"id": "workspace-resolution", "label": "IDENTITY & ROOT RESOLUTION", "role": "runtime", "x": 50, "y": 125, "w": 500, "h": 830},
    {"id": "workspace-boundary", "label": "PER-WORKFLOW WORKSPACE", "role": "data", "x": 590, "y": 125, "w": 710, "h": 830},
    {"id": "workspace-consumers", "label": "CONTAINED CONSUMERS", "role": "tool", "x": 1340, "y": 125, "w": 530, "h": 830}
  ],
  "nodes": [
    {"id": "workflow-record", "label": "Workflow record", "type": "database identity", "role": "data", "x": 90, "y": 190, "w": 420, "h": 150, "detail": ["Immutable id · mutable slug", "Stable references carry the id"]},
    {"id": "workspace-locator", "label": "Workspace locator", "type": "path resolver", "role": "runtime", "x": 90, "y": 430, "w": 420, "h": 170, "detail": ["Looks up id → slug in workflow.db", "Read-only misses may use default", "Mutations fail if id cannot resolve"]},
    {"id": "workspace-base", "label": "DATA_DIR / workspaces", "labelLines": ["DATA_DIR /", "workspaces"], "type": "filesystem root", "role": "data", "x": 90, "y": 720, "w": 420, "h": 150, "detail": ["~/.opencompany/workspaces by default", "WORKSPACE_BASE_DIR remains configurable"]},
    {"id": "workflow-workspace", "label": "workspaces/<workflow.slug>/", "type": "workspace root", "role": "data", "x": 640, "y": 190, "w": 610, "h": 160, "detail": ["Created for one workflow", "Directory moves when the slug changes"]},
    {"id": "workspace-files", "label": "Workspace files", "type": "runtime artifacts", "role": "data", "x": 640, "y": 470, "w": 280, "h": 170, "detail": ["Uploads · generated media", "Documents · code · nested files"]},
    {"id": "workspace-skills", "label": ".claude/skills/<name>/", "labelLines": [".claude/skills/", "<name>/"], "type": "materialized skills", "role": "tool", "x": 970, "y": 470, "w": 280, "h": 170, "detail": ["SKILL.md", "scripts/ + references/ preserved"]},
    {"id": "cli-worktrees", "label": "<node_id>/wt_<task_id>/", "labelLines": ["<node_id>/", "wt_<task_id>/"], "type": "CLI worktree", "role": "runtime", "x": 810, "y": 730, "w": 300, "h": 150, "detail": ["Per-task isolated branch", "Lives under the workflow workspace"]},
    {"id": "workspace-routes", "label": "Workspace HTTP routes", "labelLines": ["Workspace HTTP", "routes"], "type": "interface", "role": "interface", "x": 1380, "y": 190, "w": 440, "h": 150, "detail": ["Serve file by workflow id + path", "Accept bounded uploads"]},
    {"id": "filesystem-media", "label": "Filesystem & media nodes", "labelLines": ["Filesystem &", "media nodes"], "type": "contained I/O", "role": "tool", "x": 1380, "y": 460, "w": 440, "h": 170, "detail": ["resolve_within containment", "Traversal + symlink/junction defense", "Atomic workspace writes"]},
    {"id": "cli-agent-session", "label": "CLI agent session", "type": "agent consumer", "role": "agent", "x": 1380, "y": 730, "w": 440, "h": 150, "detail": ["Receives workspace_dir / --add-dir", "Discovers skills and owns worktrees"]}
  ],
  "relationships": [
    {"id": "r-workflow-locator", "from": "workflow-record", "to": "workspace-locator", "label": "lookup by immutable workflow id", "fromSide": "bottom", "toSide": "top", "labelAt": [300, 385]},
    {"id": "r-locator-base", "from": "workspace-locator", "to": "workspace-base", "label": "selects mutable slug below root", "fromSide": "bottom", "toSide": "top", "labelAt": [300, 665]},
    {"id": "r-base-workspace", "from": "workspace-base", "to": "workflow-workspace", "label": "contains one slug directory", "fromSide": "top", "toSide": "bottom", "waypoints": [[300, 680], [945, 680]], "labelAt": [675, 680]},
    {"id": "r-workspace-files", "from": "workflow-workspace", "to": "workspace-files", "label": "contains runtime artifacts", "fromSide": "bottom", "toSide": "top", "waypoints": [[945, 410], [780, 410]], "labelAt": [780, 410]},
    {"id": "r-workspace-skills", "from": "workflow-workspace", "to": "workspace-skills", "label": "contains isolated skill tree", "fromSide": "bottom", "toSide": "top", "waypoints": [[945, 410], [1110, 410]], "labelAt": [1110, 410]},
    {"id": "r-workspace-worktrees", "from": "workflow-workspace", "to": "cli-worktrees", "label": "contains per-node task worktrees", "fromSide": "bottom", "toSide": "top", "waypoints": [[945, 690]], "labelAt": [945, 690]},
    {"id": "r-routes-resolve", "from": "workspace-routes", "to": "workflow-workspace", "label": "resolves workflow id before file access", "protocol": "workspace locator", "fromSide": "bottom", "toSide": "bottom", "waypoints": [[1600, 400], [945, 400]], "labelAt": [1320, 400]},
    {"id": "r-filesystem-files", "from": "filesystem-media", "to": "workspace-files", "label": "reads and writes contained paths", "fromSide": "left", "toSide": "right", "labelAt": [1150, 545]},
    {"id": "r-skills-cli", "from": "workspace-skills", "to": "cli-agent-session", "label": "auto-discovers enabled skills", "protocol": "--add-dir", "fromSide": "bottom", "toSide": "left", "waypoints": [[1110, 680], [1320, 680], [1320, 805]], "labelAt": [1215, 680]},
    {"id": "r-workspace-cli", "from": "workflow-workspace", "to": "cli-agent-session", "label": "passes workspace_dir", "fromSide": "bottom", "toSide": "top", "waypoints": [[1270, 350], [1270, 690], [1600, 690]], "labelAt": [1450, 690]}
  ],
  "callouts": [],
  "prompt": {
    "primaryRequest": "Create a filesystem anatomy diagram showing how an immutable workflow ID resolves through workflow.db to a mutable slug-keyed workspace, what lives inside that workspace, and which HTTP, filesystem/media, and CLI-agent consumers access it through containment controls.",
    "composition": "Use three framed columns: Identity & Root Resolution, Per-Workflow Workspace, and Contained Consumers. Show the id→slug resolver as a vertical chain on the left; place the slug directory at the top of the middle frame with files, .claude skills, and per-task CLI worktrees below; stack HTTP routes, filesystem/media nodes, and the CLI agent on the right.",
    "constraints": ["Label the on-disk directory with workflow.slug, never workflow.id", "State that stable references and routes carry the immutable workflow id", "Show containment for relative paths and symlink/junction escapes", "Keep .claude/skills inside the per-workflow workspace", "Show CLI worktrees under the same workspace root"],
    "avoid": ["placing shipped example workflows under DATA_DIR", "using a workflow id as the workspace directory name", "showing unrestricted host filesystem access", "bidirectional arrows"]
  }
}
